輝く針の小人族　～ Little Princess,,,4000,名詞,固有名詞,一般,*,*,*,輝く針の小人族　～ Little Princess,カガヤクハリノコビトゾク,カガヤクハリノコビトゾク
魔力の雷雲,,,4000,名詞,固有名詞,一般,*,*,*,魔力の雷雲,マリョクノライウン,マリョクノライウン
始原のビート　～ Prinstine Beat,,,4000,名詞,固有名詞,一般,*,*,*,始原のビート　～ Prinstine Beat,シゲンノビート,シゲンノビート
小槌の魔力,,,4000,名詞,固有名詞,一般,*,*,*,小槌の魔力,コヅチノマリョク,コヅチノマリョク
不思議な不思議な道具達,,,4000,名詞,固有名詞,一般,*,*,*,不思議な不思議な道具達,フシギナフシギナドウグタチ,フシギナフシギナドウグタチ
反則の狼煙を上げろ,,,4000,名詞,固有名詞,一般,*,*,*,反則の狼煙を上げろ,ハンソクノノロシヲアゲロ,ハンソクノノロシヲアゲロ
不可能弾幕には反則を,,,4000,名詞,固有名詞,一般,*,*,*,不可能弾幕には反則を,フカノウダンマクニハハンソクヲ,フカノウダンマクニハハンソクヲ
ミッドナイトスペルカード,,,4000,名詞,固有名詞,一般,*,*,*,ミッドナイトスペルカード,ミッドナイトスペルカード,ミッドナイトスペルカード
ロマンチック逃飛行,,,4000,名詞,固有名詞,一般,*,*,*,ロマンチック逃飛行,ロマンチックトウヒコウ,ロマンチックトウヒコウ
永遠の三日天下,,,4000,名詞,固有名詞,一般,*,*,*,永遠の三日天下,エイエンノミッカテンカ,エイエンノミッカテンカ
心揺さぶる都市伝説,,,4000,名詞,固有名詞,一般,*,*,*,心揺さぶる都市伝説,ココロユサブルトシデンセツ,ココロユサブルトシデンセツ
幻想郷ふしぎ発見,,,4000,名詞,固有名詞,一般,*,*,*,幻想郷ふしぎ発見,ゲンソウキョウフシギハッケン,ゲンソウキョウフシギハッケン
ボールのある日常,,,4000,名詞,固有名詞,一般,*,*,*,ボールのある日常,ボールノアルニチジョウ,ボールノアルニチジョウ
顕現した伝承の形,,,4000,名詞,固有名詞,一般,*,*,*,顕現した伝承の形,ケンゲンシタデンショウノカタチ,ケンゲンシタデンショウノカタチ
時代の風の訪れ,,,4000,名詞,固有名詞,一般,*,*,*,時代の風の訪れ,ジダイノカゼノオトズレ,ジダイノカゼノオトズレ
価値がわからない,,,4000,名詞,固有名詞,一般,*,*,*,価値がわからない,カチガワカラナイ,カチガワカラナイ
可能性を信じて,,,4000,名詞,固有名詞,一般,*,*,*,可能性を信じて,カノウセイヲシンジテ,カノウセイヲシンジテ
真実を知る者,,,4000,名詞,固有名詞,一般,*,*,*,真実を知る者,シンジツヲシルモノ,シンジツヲシルモノ
外界フォークロア,,,4000,名詞,固有名詞,一般,*,*,*,外界フォークロア,ガイカイフォークロア,ガイカイフォークロア
各々の結末,,,4000,名詞,固有名詞,一般,*,*,*,各々の結末,オノオノノケツマツ,オノオノノケツマツ
明かされる深秘,,,4000,名詞,固有名詞,一般,*,*,*,明かされる深秘,アカサレルシンピ,アカサレルシンピ
オカルトアラカルト,,,4000,名詞,固有名詞,一般,*,*,*,オカルトアラカルト,オカルトアラカルト,オカルトアラカルト
七玉蒐集ショウダウン,,,4000,名詞,固有名詞,一般,*,*,*,七玉蒐集ショウダウン,シチギョクシュウシュウショウダウン,シチギョクシュウシュウショウダウン
公正なる奪い合い,,,4000,名詞,固有名詞,一般,*,*,*,公正なる奪い合い,コウセイナルウバイアイ,コウセイナルウバイアイ
対蹠地の鐘,,,4000,名詞,固有名詞,一般,*,*,*,対蹠地の鐘,タイセキチノカネ,タイセキチノカネ
竹林インフレイム,,,4000,名詞,固有名詞,一般,*,*,*,竹林インフレイム,チクリンインフレイム,チクリンインフレイム
華狭間のバトルフィールド,,,4000,名詞,固有名詞,一般,*,*,*,華狭間のバトルフィールド,ハナザマノバトルフィールド,ハナザマノバトルフィールド
ラストオカルティズム　～ 現し世の秘術師,,,4000,名詞,固有名詞,一般,*,*,*,ラストオカルティズム　～ 現し世の秘術師,ラストオカルティズム,ラストオカルティズム
宇宙巫女現る,,,4000,名詞,固有名詞,一般,*,*,*,宇宙巫女現る,ウチュウミコアラワル,ウチュウミコアラワル
忘れがたき、よすがの緑,,,4000,名詞,固有名詞,一般,*,*,*,忘れがたき、よすがの緑,ワスレガタキヨスガノミドリ,ワスレガタキヨスガノミドリ
兎は舞い降りた,,,4000,名詞,固有名詞,一般,*,*,*,兎は舞い降りた,ウサギハマイオリタ,ウサギハマイオリタ
湖は浄めの月光を映して,,,4000,名詞,固有名詞,一般,*,*,*,湖は浄めの月光を映して,ミズウミハキヨメノゲッコウヲウツシテ,ミズウミハキヨメノゲッコウヲウツシテ
九月のパンプキン,,,4000,名詞,固有名詞,一般,*,*,*,九月のパンプキン,クガツノパンプキン,クガツノパンプキン
宇宙を飛ぶ不思議な巫女,,,4000,名詞,固有名詞,一般,*,*,*,宇宙を飛ぶ不思議な巫女,ウチュウヲトブフシギナミコ,ウチュウヲトブフシギナミコ
永遠の春夢,,,4000,名詞,固有名詞,一般,*,*,*,永遠の春夢,エイエンノシュンム,エイエンノシュンム
凍り付いた永遠の都,,,4000,名詞,固有名詞,一般,*,*,*,凍り付いた永遠の都,コオリツイタエイエンノミヤコ,コオリツイタエイエンノミヤコ
逆転するホイールオブフォーチュン,,,4000,名詞,固有名詞,一般,*,*,*,逆転するホイールオブフォーチュン,ギャクテンスルホイールオブフォーチュン,ギャクテンスルホイールオブフォーチュン
遥か３８万キロのボヤージュ,,,4000,名詞,固有名詞,一般,*,*,*,遥か３８万キロのボヤージュ,ハルカサンジュウマンキロノボヤージュ,ハルカサンジュウマンキロノボヤージュ
星条旗のピエロ,,,4000,名詞,固有名詞,一般,*,*,*,星条旗のピエロ,セイジョウキノピエロ,セイジョウキノピエロ
故郷の星が映る海,,,4000,名詞,固有名詞,一般,*,*,*,故郷の星が映る海,コキョウノホシガウツルウミ,コキョウノホシガウツルウミ
ピュアヒューリーズ　～ 心の在処,,,4000,名詞,固有名詞,一般,*,*,*,ピュアヒューリーズ　～ 心の在処,ピュアヒューリーズ,ピュアヒューリーズ
見た事も無い悪夢の世界,,,4000,名詞,固有名詞,一般,*,*,*,見た事も無い悪夢の世界,ミタコトモナイアクムノセカイ,ミタコトモナイアクムノセカイ
パンデモニックプラネット,,,4000,名詞,固有名詞,一般,*,*,*,パンデモニックプラネット,パンデモニックプラネット,パンデモニックプラネット
神社から見える月,,,4000,名詞,固有名詞,一般,*,*,*,神社から見える月,ジンジャカラミエルツキ,ジンジャカラミエルツキ
宇宙巫女帰還する,,,4000,名詞,固有名詞,一般,*,*,*,宇宙巫女帰還する,ウチュウミコキカンスル,ウチュウミコキカンスル
桜舞い散る天空,,,4000,名詞,固有名詞,一般,*,*,*,桜舞い散る天空,サクラマイチルテンクウ,サクラマイチルテンクウ
希望の星は青霄に昇る,,,4000,名詞,固有名詞,一般,*,*,*,希望の星は青霄に昇る,キボウノホシハセイショウニノボル,キボウノホシハセイショウニノボル
真夏の妖精の夢,,,4000,名詞,固有名詞,一般,*,*,*,真夏の妖精の夢,マナツノヨウセイノユメ,マナツノヨウセイノユメ
色無き風は妖怪の山に,,,4000,名詞,固有名詞,一般,*,*,*,色無き風は妖怪の山に,イロナキカゼハヨウカイノヤマニ,イロナキカゼハヨウカイノヤマニ
山奥のエンカウンター,,,4000,名詞,固有名詞,一般,*,*,*,山奥のエンカウンター,ヤマオクノエンカウンター,ヤマオクノエンカウンター
桜色の海を泳いで,,,4000,名詞,固有名詞,一般,*,*,*,桜色の海を泳いで,サクライロノウミヲオヨイデ,サクライロノウミヲオヨイデ
一対の神獣,,,4000,名詞,固有名詞,一般,*,*,*,一対の神獣,イッツイノシンジュウ,イッツイノシンジュウ
幻想のホワイトトラベラー,,,4000,名詞,固有名詞,一般,*,*,*,幻想のホワイトトラベラー,ゲンソウノホワイトトラベラー,ゲンソウノホワイトトラベラー
魔法の傘地蔵,,,4000,名詞,固有名詞,一般,*,*,*,魔法の傘地蔵,マホウノカサジゾウ,マホウノカサジゾウ
禁断の扉の向こうは、この世かあの世か,,,4000,名詞,固有名詞,一般,*,*,*,禁断の扉の向こうは、この世かあの世か,キンダンノトビラノムコウハコノヨカアノヨカ,キンダンノトビラノムコウハコノヨカアノヨカ
クレイジーバックダンサーズ,,,4000,名詞,固有名詞,一般,*,*,*,クレイジーバックダンサーズ,クレイジーバックダンサーズ,クレイジーバックダンサーズ
イントゥ・バックドア,,,4000,名詞,固有名詞,一般,*,*,*,イントゥ・バックドア,イントゥバックドア,イントゥバックドア
秘匿されたフォーシーズンズ,,,4000,名詞,固有名詞,一般,*,*,*,秘匿されたフォーシーズンズ,ヒトクサレタフォーシーズンズ,ヒトクサレタフォーシーズンズ
もうドアには入れない,,,4000,名詞,固有名詞,一般,*,*,*,もうドアには入れない,モウドアニハハイレナイ,モウドアニハハイレナイ
秘神マターラ　〜 Hidden Star in All Seasons.,,,4000,名詞,固有名詞,一般,*,*,*,秘神マターラ　〜 Hidden Star in All Seasons.,ヒシンマターラ,ヒシンマターラ
不自然な自然,,,4000,名詞,固有名詞,一般,*,*,*,不自然な自然,フシゼンナシゼン,フシゼンナシゼン
白い旅人,,,4000,名詞,固有名詞,一般,*,*,*,白い旅人,シロイタビビト,シロイタビビト
蓬莱伝説,,,4000,名詞,固有名詞,一般,*,*,*,蓬莱伝説,ホウライデンセツ,ホウライデンセツ
二色蓮花蝶　～ Red and White,,,4000,名詞,固有名詞,一般,*,*,*,二色蓮花蝶　～ Red and White,ニイルレンカチョウ,ニイルレンカチョウ
桜花之恋塚　～ Japanese Flower,,,4000,名詞,固有名詞,一般,*,*,*,桜花之恋塚　～ Japanese Flower,オウカノコイヅカ,オウカノコイヅカ
エニグマティクドール,,,4000,名詞,固有名詞,一般,*,*,*,エニグマティクドール,エニグマティクドール,エニグマティクドール
サーカスレヴァリエ,,,4000,名詞,固有名詞,一般,*,*,*,サーカスレヴァリエ,サーカスレヴァリエ,サーカスレヴァリエ
人形の森,,,4000,名詞,固有名詞,一般,*,*,*,人形の森,ニンギョウノモリ,ニンギョウノモリ
Witch of Love Potion,,,4000,名詞,固有名詞,一般,*,*,*,Witch of Love Potion,ウィッチオブラブポーション,ウィッチオブラブポーション
リーインカーネイション,,,4000,名詞,固有名詞,一般,*,*,*,リーインカーネイション,リーインカーネイション,リーインカーネイション
空飛ぶ巫女の不思議な毎日,,,4000,名詞,固有名詞,一般,*,*,*,空飛ぶ巫女の不思議な毎日,ソラトブミコノフシギナマイニチ,ソラトブミコノフシギナマイニチ
夜のデンデラ野を逝く,,,4000,名詞,固有名詞,一般,*,*,*,夜のデンデラ野を逝く,ヨルノデンデラノヲユク,ヨルノデンデラノヲユク
少女秘封倶楽部,,,4000,名詞,固有名詞,一般,*,*,*,少女秘封倶楽部,ショウジョヒフウクラブ,ショウジョヒフウクラブ
古の冥界寺,,,4000,名詞,固有名詞,一般,*,*,*,古の冥界寺,イニシエノメイカイデラ,イニシエノメイカイデラ
魔術師メリー,,,4000,名詞,固有名詞,一般,*,*,*,魔術師メリー,マジュツシメリー,マジュツシメリー
月の妖鳥、化猫の幻,,,4000,名詞,固有名詞,一般,*,*,*,月の妖鳥、化猫の幻,ツキノヨウチョウバケネコノマボロシ,ツキノヨウチョウバケネコノマボロシ
過去の花　～ Fairy of Flower,,,4000,名詞,固有名詞,一般,*,*,*,過去の花　～ Fairy of Flower,カコノハナ,カコノハナ
魔法少女十字軍,,,4000,名詞,固有名詞,一般,*,*,*,魔法少女十字軍,マホウショウジョジュウジグン,マホウショウジョジュウジグン
幻想の永遠祭,,,4000,名詞,固有名詞,一般,*,*,*,幻想の永遠祭,ゲンソウノエイエンサイ,ゲンソウノエイエンサイ
童祭　～ Innocent Treasures,,,4000,名詞,固有名詞,一般,*,*,*,童祭　～ Innocent Treasures,ワラベマツリ,ワラベマツリ
華胥の夢,,,4000,名詞,固有名詞,一般,*,*,*,華胥の夢,カショノユメ,カショノユメ
科学世紀の少年少女,,,4000,名詞,固有名詞,一般,*,*,*,科学世紀の少年少女,カガクセイキノショウネンショウジョ,カガクセイキノショウネンショウジョ
永夜の報い　～ Imperishable Night,,,4000,名詞,固有名詞,一般,*,*,*,永夜の報い　～ Imperishable Night,エイヤノムクイ,エイヤノムクイ
夢と現の境界,,,4000,名詞,固有名詞,一般,*,*,*,夢と現の境界,ユメトウツツノキョウカイ,ユメトウツツノキョウカイ
幻想機械　～ Phantom Factory,,,4000,名詞,固有名詞,一般,*,*,*,幻想機械　～ Phantom Factory,ゲンソウキカイ,ゲンソウキカイ
幽玄の槭樹　～ Eternal Dream,,,4000,名詞,固有名詞,一般,*,*,*,幽玄の槭樹　～ Eternal Dream,ユウゲンノカエデ,ユウゲンノカエデ
ヒロシゲ36号　～ Neo Super-Express,,,4000,名詞,固有名詞,一般,*,*,*,ヒロシゲ36号　～ Neo Super-Express,ヒロシゲサンジュウロクゴウ,ヒロシゲサンジュウロクゴウ
53ミニッツの青い海,,,4000,名詞,固有名詞,一般,*,*,*,53ミニッツの青い海,ゴジュウサンミニッツノアオイウミ,ゴジュウサンミニッツノアオイウミ
青木ヶ原の伝説,,,4000,名詞,固有名詞,一般,*,*,*,青木ヶ原の伝説,アオキガハラノデンセツ,アオキガハラノデンセツ
最も澄みわたる空と海,,,4000,名詞,固有名詞,一般,*,*,*,最も澄みわたる空と海,モットモスミワタルソラトウミ,モットモスミワタルソラトウミ
月面ツアーへようこそ,,,4000,名詞,固有名詞,一般,*,*,*,月面ツアーへようこそ,ゲツメンツアーヘヨウコソ,ゲツメンツアーヘヨウコソ
天空のグリニッジ,,,4000,名詞,固有名詞,一般,*,*,*,天空のグリニッジ,テンクウノグリニッジ,テンクウノグリニッジ
車椅子の未来宇宙,,,4000,名詞,固有名詞,一般,*,*,*,車椅子の未来宇宙,クルマイスノミライウチュウ,クルマイスノミライウチュウ
衛星カフェテラス,,,4000,名詞,固有名詞,一般,*,*,*,衛星カフェテラス,エイセイカフェテラス,エイセイカフェテラス
G Free,,,4000,名詞,固有名詞,一般,*,*,*,G Free,ジーフリー,ジーフリー
大空魔術　～ Magical Astronomy,,,4000,名詞,固有名詞,一般,*,*,*,大空魔術　～ Magical Astronomy,オオゾラマジュツ,オオゾラマジュツ
向こう側の月,,,4000,名詞,固有名詞,一般,*,*,*,向こう側の月,ムコウガワノツキ,ムコウガワノツキ
Gの向こう,,,4000,名詞,固有名詞,一般,*,*,*,Gの向こう,ジーノムコウ,ジーノムコウ
未知の花　魅知の旅,,,4000,名詞,固有名詞,一般,*,*,*,未知の花　魅知の旅,ミチノハナミチノタビ,ミチノハナミチノタビ
衛星トリフネ,,,4000,名詞,固有名詞,一般,*,*,*,衛星トリフネ,エイセイトリフネ,エイセイトリフネ
トロヤ群の密林,,,4000,名詞,固有名詞,一般,*,*,*,トロヤ群の密林,トロヤグンノミツリン,トロヤグンノミツリン
フェアリー冒険譚,,,4000,名詞,固有名詞,一般,*,*,*,フェアリー冒険譚,フェアリーボウケンタン,フェアリーボウケンタン
天鳥船神社,,,4000,名詞,固有名詞,一般,*,*,*,天鳥船神社,アメノトリフネジンジャ,アメノトリフネジンジャ
天鳥船神社の結界,,,4000,名詞,固有名詞,一般,*,*,*,天鳥船神社の結界,アメノトリフネジンジャノケッカイ,アメノトリフネジンジャノケッカイ
宇宙に浮かぶ幻想郷,,,4000,名詞,固有名詞,一般,*,*,*,宇宙に浮かぶ幻想郷,ウチュウニウカブゲンソウキョウ,ウチュウニウカブゲンソウキョウ
緑のサナトリウム,,,4000,名詞,固有名詞,一般,*,*,*,緑のサナトリウム,ミドリノサナトリウム,ミドリノサナトリウム
牛に引かれて善光寺参り,,,4000,名詞,固有名詞,一般,*,*,*,牛に引かれて善光寺参り,ウシニヒカレテゼンコウジマイリ,ウシニヒカレテゼンコウジマイリ
アガルタの風,,,4000,名詞,固有名詞,一般,*,*,*,アガルタの風,アガルタノカゼ,アガルタノカゼ
イザナギオブジェクト,,,4000,名詞,固有名詞,一般,*,*,*,イザナギオブジェクト,イザナギオブジェクト,イザナギオブジェクト
日本中の不思議を集めて,,,4000,名詞,固有名詞,一般,*,*,*,日本中の不思議を集めて,ニホンジュウノフシギヲアツメテ,ニホンジュウノフシギヲアツメテ
他愛も無い二人の博物誌,,,4000,名詞,固有名詞,一般,*,*,*,他愛も無い二人の博物誌,タアイモナイフタリノハクブツシ,タアイモナイフタリノハクブツシ
Dr.レイテンシーの眠れなくなる瞳,,,4000,名詞,固有名詞,一般,*,*,*,Dr.レイテンシーの眠れなくなる瞳,ドクターレイテンシーノネムレナクナルヒトミ,ドクターレイテンシーノネムレナクナルヒトミ
須臾はプランクを超えて,,,4000,名詞,固有名詞,一般,*,*,*,須臾はプランクを超えて,シュユハプランクヲコエテ,シュユハプランクヲコエテ
シュレディンガーの化猫,,,4000,名詞,固有名詞,一般,*,*,*,シュレディンガーの化猫,シュレディンガーノバケネコ,シュレディンガーノバケネコ
禁忌の膜壁,,,4000,名詞,固有名詞,一般,*,*,*,禁忌の膜壁,キンキノマクヘキ,キンキノマクヘキ
バー・オールドアダム,,,4000,名詞,固有名詞,一般,*,*,*,バー・オールドアダム,バー・オールドアダム,バー・オールドアダム
燕石博物誌が連れてきた闇,,,4000,名詞,固有名詞,一般,*,*,*,燕石博物誌が連れてきた闇,エンセキハクブツシガツレテキタヤミ,エンセキハクブツシガツレテキタヤミ
アウトサイダーカクテル,,,4000,名詞,固有名詞,一般,*,*,*,アウトサイダーカクテル,アウトサイダーカクテル,アウトサイダーカクテル
旧世界の冒険酒場,,,4000,名詞,固有名詞,一般,*,*,*,旧世界の冒険酒場,キュウセカイノボウケンサカバ,キュウセカイノボウケンサカバ
二日酔いの同床異夢,,,4000,名詞,固有名詞,一般,*,*,*,二日酔いの同床異夢,フツカヨイノドウショウイム,フツカヨイノドウショウイム
バー・オールドアダム,,,4000,名詞,固有名詞,一般,*,*,*,バー・オールドアダム,バーオールドアダム,バーオールドアダム
花映塚　～ after Higan Retour,,,4000,名詞,固有名詞,一般,*,*,*,花映塚　～ after Higan Retour,カエイヅカ,カエイヅカ
ジャパニーズサーガ,,,4000,名詞,固有名詞,一般,*,*,*,ジャパニーズサーガ,ジャパニーズサーガ,ジャパニーズサーガ
阿礼の子供,,,4000,名詞,固有名詞,一般,*,*,*,阿礼の子供,アレノコドモ,アレノコドモ
夜の鳩山を飛ぶ　-Power MIX,,,4000,名詞,固有名詞,一般,*,*,*,夜の鳩山を飛ぶ　-Power MIX,ヨルノハトヤマヲトブ,ヨルノハトヤマヲトブ
サニールチルフレクション,,,4000,名詞,固有名詞,一般,*,*,*,サニールチルフレクション,サニールチルフレクション,サニールチルフレクション
夜だから眠れない,,,4000,名詞,固有名詞,一般,*,*,*,夜だから眠れない,ヨルダカラネムレナイ,ヨルダカラネムレナイ
妖精燦々として,,,4000,名詞,固有名詞,一般,*,*,*,妖精燦々として,ヨウセイサンサントシテ,ヨウセイサンサントシテ
サニーミルクの紅霧異変,,,4000,名詞,固有名詞,一般,*,*,*,サニーミルクの紅霧異変,サニーミルクノコウムイヘン,サニーミルクノコウムイヘン
雪月桜花の国,,,4000,名詞,固有名詞,一般,*,*,*,雪月桜花の国,セツゲツオウカノクニ,セツゲツオウカノクニ
スターヴォヤージュ2008,,,4000,名詞,固有名詞,一般,*,*,*,スターヴォヤージュ2008,スターゔォヤージュ2008,スターゔォヤージュニセンハチ
二つの世界,,,4000,名詞,固有名詞,一般,*,*,*,二つの世界,フタツノセカイ,フタツノセカイ
神域のかくれんぼ暮らし,,,4000,名詞,固有名詞,一般,*,*,*,神域のかくれんぼ暮らし,シンイキノカクレンボクラシ,シンイキノカクレンボクラシ
妖怪宇宙旅行,,,4000,名詞,固有名詞,一般,*,*,*,妖怪宇宙旅行,ヨウカイウチュウリョコウ,ヨウカイウチュウリョコウ
綿月のスペルカード　～ Lunatic Blue,,,4000,名詞,固有名詞,一般,*,*,*,綿月のスペルカード　～ Lunatic Blue,ワタツキノスペルカード,ワタツキノスペルカード
呑んべぇのレムリア (Retro Ver),,,4000,名詞,固有名詞,一般,*,*,*,呑んべぇのレムリア (Retro Ver),ノンベェノレムリア,ノンベェノレムリア
魔法使いの憂鬱,,,4000,名詞,固有名詞,一般,*,*,*,魔法使いの憂鬱,マホウツカイノユウウツ,マホウツカイノユウウツ
スプートニク幻夜,,,4000,名詞,固有名詞,一般,*,*,*,スプートニク幻夜,スプートニクゲンヤ,スプートニクゲンヤ
秋霜玉　～ Clockworks,,,4000,名詞,固有名詞,一般,*,*,*,秋霜玉　～ Clockworks,シュウソウギョク,シュウソウギョク
フォルスストロベリー,,,4000,名詞,固有名詞,一般,*,*,*,フォルスストロベリー,フォルスストロベリー,フォルスストロベリー
プリムローズシヴァ,,,4000,名詞,固有名詞,一般,*,*,*,プリムローズシヴァ,プリムローズシゔァ,プリムローズシゔァ
幻想帝都,,,4000,名詞,固有名詞,一般,*,*,*,幻想帝都,ゲンソウテイト,ゲンソウテイト
ディザストラスジェミニ,,,4000,名詞,固有名詞,一般,*,*,*,ディザストラスジェミニ,ディザストラスジェミニ,ディザストラスジェミニ
華の幻想　紅夢の宙,,,4000,名詞,固有名詞,一般,*,*,*,華の幻想　紅夢の宙,ハナノゲンソウコウムノソラ,ハナノゲンソウコウムノソラ
天空アーミー,,,4000,名詞,固有名詞,一般,*,*,*,天空アーミー,テンクウアーミー,テンクウアーミー
機械サーカス　～ Reverie,,,4000,名詞,固有名詞,一般,*,*,*,機械サーカス　～ Reverie,キカイサーカス,キカイサーカス
カナベラルの夢幻少女,,,4000,名詞,固有名詞,一般,*,*,*,カナベラルの夢幻少女,カナベラルノムゲンショウジョ,カナベラルノムゲンショウジョ
アンティークテラー,,,4000,名詞,固有名詞,一般,*,*,*,アンティークテラー,アンティークテラー,アンティークテラー
夢機械　～ Innocent Power,,,4000,名詞,固有名詞,一般,*,*,*,夢機械　～ Innocent Power,ユメキカイ,ユメキカイ
幻想科学　～ Doll's Phantom,,,4000,名詞,固有名詞,一般,*,*,*,幻想科学　～ Doll's Phantom,ゲンソウカガク,ゲンソウカガク
少女神性　～ Pandora's Box,,,4000,名詞,固有名詞,一般,*,*,*,少女神性　～ Pandora's Box,ショウジョシンセイ,ショウジョシンセイ
シルクロードアリス,,,4000,名詞,固有名詞,一般,*,*,*,シルクロードアリス,シルクロードアリス,シルクロードアリス
魔女達の舞踏会　～ Magus,,,4000,名詞,固有名詞,一般,*,*,*,魔女達の舞踏会　～ Magus,マジョタチノブトウカイ,マジョタチノブトウカイ
ハーセルヴズ,,,4000,名詞,固有名詞,一般,*,*,*,ハーセルヴズ,ハーセルウズ,ハーセルウズ
タイトルドメイド,,,4000,名詞,固有名詞,一般,*,*,*,タイトルドメイド,タイトルドメイド,タイトルドメイド
華の幻想　紅夢の宙,,,4000,名詞,固有名詞,一般,*,*,*,華の幻想　紅夢の宙,ハナノゲンソウ,ハナノゲンソウ
稀翁玉　～ Fairy Dance,,,4000,名詞,固有名詞,一般,*,*,*,稀翁玉　～ Fairy Dance,キオウギョク,キオウギョク
天鵞絨少女戦　～ Velvet Battle,,,4000,名詞,固有名詞,一般,*,*,*,天鵞絨少女戦　～ Velvet Battle,ビロオドショウジョセン,ビロオドショウジョセン
