Castle Explorer -in the Sky-,,,4000,名詞,固有名詞,一般,*,*,*,Castle Explorer -in the Sky-,キャッスルエクスプローラ,キャッスルエクスプローラ
オルフェの詩　～ Pseudoclassic,,,4000,名詞,固有名詞,一般,*,*,*,オルフェの詩　～ Pseudoclassic,オルフェノウタ,オルフェノウタ
新幻想　～ New Fantasy,,,4000,名詞,固有名詞,一般,*,*,*,新幻想　～ New Fantasy,シンゲンソウ,シンゲンソウ
オルレアンの聖騎士,,,4000,名詞,固有名詞,一般,*,*,*,オルレアンの聖騎士,オルレアンノセイキシ,オルレアンノセイキシ
"My Maid, Sweet Maid",,,4000,名詞,固有名詞,一般,*,*,*,"My Maid, Sweet Maid",マイメイドスイートメイド,マイメイドスイートメイド
桜花之恋塚　～ Flower of Japan,,,4000,名詞,固有名詞,一般,*,*,*,桜花之恋塚　～ Flower of Japan,オウカノコイヅカ,オウカノコイヅカ
乙女戦士　～ Heart of Valkyrie,,,4000,名詞,固有名詞,一般,*,*,*,乙女戦士　～ Heart of Valkyrie,オトメセンシ,オトメセンシ
エニグマティクドール　～ God Knows,,,4000,名詞,固有名詞,一般,*,*,*,エニグマティクドール　～ God Knows,エニグマティクドール,エニグマティクドール
Magical and Hopeless,,,4000,名詞,固有名詞,一般,*,*,*,Magical and Hopeless,マジカルアンドホープレス,マジカルアンドホープレス
Sacred Battle,,,4000,名詞,固有名詞,一般,*,*,*,Sacred Battle,セイクリッドバトル,セイクリッドバトル
妖々跋扈　～ Speed Fox!,,,4000,名詞,固有名詞,一般,*,*,*,妖々跋扈　～ Speed Fox!,ヨウヨウバッコ,ヨウヨウバッコ
六十年目の東方裁判,,,4000,名詞,固有名詞,一般,*,*,*,六十年目の東方裁判,ロクジュウネンメノトウホウサイバン,ロクジュウネンメノトウホウサイバン
呑んべぇのレムリア,,,4000,名詞,固有名詞,一般,*,*,*,呑んべぇのレムリア,ノンベェノレムリア,ノンベェノレムリア
AN ORDEAL FROM GOD,,,4000,名詞,固有名詞,一般,*,*,*,AN ORDEAL FROM GOD,アンオーディールフロムゴッド,アンオーディールフロムゴッド
キュアリアス上海古牌,,,4000,名詞,固有名詞,一般,*,*,*,キュアリアス上海古牌,キュアリアスシャンハイグーパイ,キュアリアスシャンハイグーパイ
神魔討綺伝 AN ORDEAL FROM GOD,,,4000,名詞,固有名詞,一般,*,*,*,神魔討綺伝 AN ORDEAL FROM GOD,シンマトウキデン,シンマトウキデン
Mysterious Shrine,,,4000,名詞,固有名詞,一般,*,*,*,Mysterious Shrine,ミステリアスシュライン,ミステリアスシュライン
宵闇の魔術師,,,4000,名詞,固有名詞,一般,*,*,*,宵闇の魔術師,ヨイヤミノマジュツシ,ヨイヤミノマジュツシ
Magic of Life,,,4000,名詞,固有名詞,一般,*,*,*,Magic of Life,マジックオブライフ,マジックオブライフ
Plastic Space,,,4000,名詞,固有名詞,一般,*,*,*,Plastic Space,プラスチックスペース,プラスチックスペース
Inventive City,,,4000,名詞,固有名詞,一般,*,*,*,Inventive City,インベンティブシティ,インベンティブシティ
夢幻回廊,,,4000,名詞,固有名詞,一般,*,*,*,夢幻回廊,ムゲンカイロウ,ムゲンカイロウ
蓬莱幻想　～ far East,,,4000,名詞,固有名詞,一般,*,*,*,蓬莱幻想　～ far East,ホウライゲンソウ,ホウライゲンソウ
魔法少女十字軍　～ Little Little Crusader,,,4000,名詞,固有名詞,一般,*,*,*,魔法少女十字軍　～ Little Little Crusader,マホウショウジョジュウジグン,マホウショウジョジュウジグン
夜の鳩山を飛ぶ,,,4000,名詞,固有名詞,一般,*,*,*,夜の鳩山を飛ぶ,ヨルノハトヤマヲトブ,ヨルノハトヤマヲトブ
Frontal Attack,,,4000,名詞,固有名詞,一般,*,*,*,Frontal Attack,フロンタルアタック,フロンタルアタック
千里の道,,,4000,名詞,固有名詞,一般,*,*,*,千里の道,センリノミチ,センリノミチ
地の色は黄色　〜 Primrose,,,4000,名詞,固有名詞,一般,*,*,*,地の色は黄色　〜 Primrose,チノイロハキイロ,チノイロハキイロ
マッシュルーム・ワルツ,,,4000,名詞,固有名詞,一般,*,*,*,マッシュルーム・ワルツ,マッシュルームワルツ,マッシュルームワルツ
聖輦船空を往く,,,4000,名詞,固有名詞,一般,*,*,*,聖輦船空を往く,セイレンセンソラヲイク,セイレンセンソラヲイク
法力の下の平等,,,4000,名詞,固有名詞,一般,*,*,*,法力の下の平等,ホウリキノモトノビョウドウ,ホウリキノモトノビョウドウ
恒常不変の参廟祀,,,4000,名詞,固有名詞,一般,*,*,*,恒常不変の参廟祀,コウジョウフヘンノサンビョウシ,コウジョウフヘンノサンビョウシ
光輝く天球儀,,,4000,名詞,固有名詞,一般,*,*,*,光輝く天球儀,ヒカリカガヤクテンキュウギ,ヒカリカガヤクテンキュウギ
沢の河童の技術力,,,4000,名詞,固有名詞,一般,*,*,*,沢の河童の技術力,サワノカッパノギジュツリョク,サワノカッパノギジュツリョク
地底に咲く薔薇,,,4000,名詞,固有名詞,一般,*,*,*,地底に咲く薔薇,チテイニサクバラ,チテイニサクバラ
深緑の狸森にて,,,4000,名詞,固有名詞,一般,*,*,*,深緑の狸森にて,シンリョウノタヌキモリニテ,シンリョウノタヌキモリニテ
心綺楼演舞,,,4000,名詞,固有名詞,一般,*,*,*,心綺楼演舞,シンキロウエンブ,シンキロウエンブ
不滅のレッドソウル,,,4000,名詞,固有名詞,一般,*,*,*,不滅のレッドソウル,フメツノレッドソウル,フメツノレッドソウル
落日に映える逆さ城,,,4000,名詞,固有名詞,一般,*,*,*,落日に映える逆さ城,ラクジツニハエルサカサジロ,ラクジツニハエルサカサジロ
千の試練を超えて,,,4000,名詞,固有名詞,一般,*,*,*,千の試練を超えて,センノシレンヲコエテ,センノシレンヲコエテ
夢世界フォークロア,,,4000,名詞,固有名詞,一般,*,*,*,夢世界フォークロア,ユメセカイフォークロア,ユメセカイフォークロア
永遠に続く回廊,,,4000,名詞,固有名詞,一般,*,*,*,永遠に続く回廊,エイエンニツヅクカイロウ,エイエンニツヅクカイロウ
スリープシープ・パレード,,,4000,名詞,固有名詞,一般,*,*,*,スリープシープ・パレード,スリープシープパレード,スリープシープパレード
至る有頂天,,,4000,名詞,固有名詞,一般,*,*,*,至る有頂天,イタルウチョウテン,イタルウチョウテン
憑坐のは夢と現の間に　〜 Necro-Fantasia,,,4000,名詞,固有名詞,一般,*,*,*,憑坐のは夢と現の間に　〜 Necro-Fantasia,ヨリマシハユメトウツツノアイダニ,ヨリマシハユメトウツツノアイダニ
今宵は飄逸なエゴイスト(Live ver)　〜 Egoistic Flowers.,,,4000,名詞,固有名詞,一般,*,*,*,今宵は飄逸なエゴイスト(Live ver)　〜 Egoistic Flowers.,コヨイハヒョウイツナエゴイスト,コヨイハヒョウイツナエゴイスト
オカルトアトラクト,,,4000,名詞,固有名詞,一般,*,*,*,オカルトアトラクト,オカルトアトラクト,オカルトアトラクト
ネオ竹林インフレイム,,,4000,名詞,固有名詞,一般,*,*,*,ネオ竹林インフレイム,ネオチクリンインフレイム,ネオチクリンインフレイム
億万劫の鐘,,,4000,名詞,固有名詞,一般,*,*,*,億万劫の鐘,オクマンゴウノカネ,オクマンゴウノカネ
アンノウンX　〜 Occultly Madness,,,4000,名詞,固有名詞,一般,*,*,*,アンノウンX　〜 Occultly Madness,アンノウンエックス,アンノウンエックス
憑依統合,,,4000,名詞,固有名詞,一般,*,*,*,憑依統合,ヒョウイトウゴウ,ヒョウイトウゴウ
連帯責任,,,4000,名詞,固有名詞,一般,*,*,*,連帯責任,レンタイセキニン,レンタイセキニン
合縁奇縁,,,4000,名詞,固有名詞,一般,*,*,*,合縁奇縁,アイエンキエン,アイエンキエン
異心同体,,,4000,名詞,固有名詞,一般,*,*,*,異心同体,イシンドウタイ,イシンドウタイ
壮言大語,,,4000,名詞,固有名詞,一般,*,*,*,壮言大語,ソウゲンタイゴ,ソウゲンタイゴ
知略縦横,,,4000,名詞,固有名詞,一般,*,*,*,知略縦横,チリャクジュウオウ,チリャクジュウオウ
意気揚々,,,4000,名詞,固有名詞,一般,*,*,*,意気揚々,イキヨウヨウ,イキヨウヨウ
開演間近,,,4000,名詞,固有名詞,一般,*,*,*,開演間近,カイエンマヂカ,カイエンマヂカ
天衣無縫　〜 Yellow Lily,,,4000,名詞,固有名詞,一般,*,*,*,天衣無縫　〜 Yellow Lily,テンイムホウ,テンイムホウ
行雲流水,,,4000,名詞,固有名詞,一般,*,*,*,行雲流水,コウウンリュウスイ,コウウンリュウスイ
異変の種子,,,4000,名詞,固有名詞,一般,*,*,*,異変の種子,イヘンノシュシ,イヘンノシュシ
疑惑の芽生え,,,4000,名詞,固有名詞,一般,*,*,*,疑惑の芽生え,ギワクノメバエ,ギワクノメバエ
未だ蕾む憑依華,,,4000,名詞,固有名詞,一般,*,*,*,未だ蕾む憑依華,イマダツボムヒョウイバナ,イマダツボムヒョウイバナ
真相へ繋がる枝葉,,,4000,名詞,固有名詞,一般,*,*,*,真相へ繋がる枝葉,シンソウヘツナガルエダハ,シンソウヘツナガルエダハ
咲き誇る憑依華,,,4000,名詞,固有名詞,一般,*,*,*,咲き誇る憑依華,サキホコルヒョウイバナ,サキホコルヒョウイバナ
舞い散る憑依華吹雪,,,4000,名詞,固有名詞,一般,*,*,*,舞い散る憑依華吹雪,マイチルヒョウイバナフブキ,マイチルヒョウイバナフブキ
憑坐のは夢と現の間に,,,4000,名詞,固有名詞,一般,*,*,*,憑坐のは夢と現の間に,ネオチクリンインフレイム,ネオチクリンインフレイム
今宵は飄逸なエゴイスト(Live ver),,,4000,名詞,固有名詞,一般,*,*,*,今宵は飄逸なエゴイスト(Live ver),オクマンゴウノカネ,オクマンゴウノカネ
今宵は飄逸なエゴイスト,,,4000,名詞,固有名詞,一般,*,*,*,今宵は飄逸なエゴイスト,オクマンゴウノカネ,オクマンゴウノカネ
